{
  "$schema": "http://json-schema.org/draft-07/schema#",
  "$id": "https://main-street.example/schemas/main-street-storyline.schema.json",
  "title": "Main Street Storyline Manifest",
  "description": "Machine-readable manifest of the Main Street storyline graph, generated from src/card-data.csv by src/scripts/storyline-graph.ts (--format json). Deterministic: no timestamps.",
  "type": "object",
  "required": ["version", "source", "storylineIds", "nodes", "edges", "cycles"],
  "additionalProperties": false,
  "properties": {
    "version": {
      "type": "integer",
      "minimum": 1,
      "description": "Manifest schema version."
    },
    "source": {
      "type": "string",
      "minLength": 1,
      "description": "Generator provenance (deterministic)."
    },
    "storylineIds": {
      "type": "array",
      "items": { "type": "string", "minLength": 1 },
      "uniqueItems": true,
      "description": "Sorted storyline ids present in the graph."
    },
    "nodes": {
      "type": "array",
      "items": { "$ref": "#/definitions/node" }
    },
    "edges": {
      "type": "array",
      "items": { "$ref": "#/definitions/edge" }
    },
    "cycles": {
      "type": "array",
      "description": "Detected cycles (first-class shape); each entry is a cycle path of base card ids.",
      "items": {
        "type": "array",
        "minItems": 1,
        "items": { "type": "string", "minLength": 1 },
        "uniqueItems": true
      }
    }
  },
  "definitions": {
    "node": {
      "type": "object",
      "required": [
        "id",
        "name",
        "storylineId",
        "storylineTitle",
        "hasChoices",
        "optionCount",
        "coinDelta",
        "reputationDelta",
        "trigger",
        "effect",
        "target",
        "targetSynergy",
        "cost",
        "tier",
        "coinPercentDelta",
        "duration",
        "effectType",
        "multiplier"
      ],
      "additionalProperties": false,
      "properties": {
        "id": { "type": "string", "minLength": 1, "description": "Base card id (no instance serial)." },
        "name": { "type": "string", "minLength": 1 },
        "storylineId": { "type": ["string", "null"] },
        "storylineTitle": { "type": ["string", "null"] },
        "hasChoices": { "type": "boolean" },
        "optionCount": { "type": "integer", "minimum": 0 },
        "options": {
          "type": "array",
          "description": "Ordered labelled option list of the arbitrary multi-outcome model (MS-0MUZKA9CJ000N144). Present on choice nodes; each option carries its candidate successor set (empty = terminal chain-end).",
          "items": { "$ref": "#/definitions/option" }
        },
        "coinDelta": { "type": "number" },
        "reputationDelta": { "type": "number" },
        "trigger": { "type": "string", "description": "When the event resolves (Incident/Investment)." },
        "effect": { "type": "string", "description": "Human-readable effect text shown to the player." },
        "target": { "type": "string", "description": "Effect scope (All/SpecificSynergy/RandomBusiness)." },
        "targetSynergy": { "type": ["string", "null"], "description": "Targeted synergy, when target is SpecificSynergy." },
        "cost": { "type": "number", "description": "Card cost." },
        "tier": { "type": ["number", "null"], "description": "Severity/availability tier, or null when unknown." },
        "coinPercentDelta": { "type": ["number", "null"], "description": "Signed fraction of banked coins, or null." },
        "duration": { "type": ["number", "null"], "description": "Duration in turns for duration-based events." },
        "effectType": { "type": ["string", "null"], "description": "Duration discriminator (e.g. income-multiplier)." },
        "multiplier": { "type": ["number", "null"], "description": "Duration scalar (e.g. 0.8 for 80% income)." }
      }
    },
    "edge": {
      "type": "object",
      "required": ["from", "label", "to", "random", "candidateIndex", "cycle", "effectPolicy"],
      "additionalProperties": false,
      "properties": {
        "from": { "type": "string", "minLength": 1, "description": "Source base card id." },
        "label": { "type": "string", "minLength": 1, "description": "Option label (e.g. Accept, Reject, Negotiate)." },
        "to": {
          "type": ["string", "null"],
          "description": "Target base card id — one edge per candidate successor of the option's set; null when the chain ends."
        },
        "random": {
          "type": "boolean",
          "description": "True when this edge is one of several random-branch candidates of the same option (candidate set size > 1). Presentational in the Mermaid/SVG renders; the engine draws uniformly at random at resolution time."
        },
        "candidateIndex": {
          "type": "integer",
          "minimum": 0,
          "description": "0-based index of this candidate within its option's ordered candidate set."
        },
        "cycle": { "type": "boolean", "description": "True when this edge participates in a cycle." },
        "effectPolicy": {
          "type": "string",
          "enum": ["apply", "skip"],
          "description": "Whether the source event's own effect applies when this option is chosen."
        }
      }
    },
    "option": {
      "type": "object",
      "required": ["label", "successorIds", "effectPolicy"],
      "additionalProperties": false,
      "description": "One labelled player option of an arbitrary multi-outcome choice node.",
      "properties": {
        "label": { "type": "string", "minLength": 1, "description": "Player-visible option label; also the stable transcript/save token." },
        "successorIds": {
          "type": "array",
          "description": "Ordered candidate successor base card ids; empty = terminal chain-end. The engine draws one uniformly at random at resolution time.",
          "items": { "type": "string", "minLength": 1 }
        },
        "effectPolicy": {
          "type": "string",
          "enum": ["apply", "skip"],
          "description": "Whether the source event's own effect applies when this option is chosen (CSV-authored options are always 'apply')."
        }
      }
    }
  }
}
