{
  "version": 1,
  "source": "Generated from src/card-data.csv via the typed storyline model (deterministic).",
  "storylineIds": [
    "storyline-economy",
    "storyline-health",
    "storyline-labor",
    "storyline-restaurant",
    "storyline-tax"
  ],
  "nodes": [
    {
      "id": "evt-art-sale",
      "name": "Art Sale",
      "storylineId": null,
      "storylineTitle": null,
      "hasChoices": false,
      "optionCount": 0,
      "options": [],
      "coinDelta": 200,
      "reputationDelta": 100,
      "trigger": "Investment",
      "effect": "+200 coins to all Culture businesses and +100 reputation.",
      "target": "SpecificSynergy",
      "targetSynergy": "Culture",
      "cost": 350,
      "tier": 7,
      "coinPercentDelta": null,
      "duration": null,
      "effectType": null,
      "multiplier": null
    },
    {
      "id": "evt-award",
      "name": "Community Award",
      "storylineId": null,
      "storylineTitle": null,
      "hasChoices": false,
      "optionCount": 0,
      "options": [],
      "coinDelta": 0,
      "reputationDelta": 200,
      "trigger": "Incident",
      "effect": "Gain 200 reputation from community recognition.",
      "target": "All",
      "targetSynergy": null,
      "cost": 0,
      "tier": 1,
      "coinPercentDelta": null,
      "duration": null,
      "effectType": null,
      "multiplier": null
    },
    {
      "id": "evt-block-party",
      "name": "Block Party",
      "storylineId": null,
      "storylineTitle": null,
      "hasChoices": false,
      "optionCount": 0,
      "options": [],
      "coinDelta": 250,
      "reputationDelta": 350,
      "trigger": "Investment",
      "effect": "+250 coins per Entertainment business and +350 reputation.",
      "target": "SpecificSynergy",
      "targetSynergy": "Entertainment",
      "cost": 500,
      "tier": 3,
      "coinPercentDelta": null,
      "duration": null,
      "effectType": null,
      "multiplier": null
    },
    {
      "id": "evt-book-fair",
      "name": "Book Fair",
      "storylineId": null,
      "storylineTitle": null,
      "hasChoices": false,
      "optionCount": 0,
      "options": [],
      "coinDelta": 300,
      "reputationDelta": 950,
      "trigger": "Investment",
      "effect": "+300 coin to each Culture business and +950 reputation from literary events.",
      "target": "SpecificSynergy",
      "targetSynergy": "Culture",
      "cost": 900,
      "tier": 11,
      "coinPercentDelta": null,
      "duration": null,
      "effectType": null,
      "multiplier": null
    },
    {
      "id": "evt-bulk-purchase",
      "name": "Bulk Purchase",
      "storylineId": null,
      "storylineTitle": null,
      "hasChoices": false,
      "optionCount": 0,
      "options": [],
      "coinDelta": 300,
      "reputationDelta": 950,
      "trigger": "Investment",
      "effect": "+300 coin to each Commerce business and +950 reputation from collective buying power.",
      "target": "SpecificSynergy",
      "targetSynergy": "Commerce",
      "cost": 900,
      "tier": 11,
      "coinPercentDelta": null,
      "duration": null,
      "effectType": null,
      "multiplier": null
    },
    {
      "id": "evt-charity-drive",
      "name": "Charity Drive",
      "storylineId": null,
      "storylineTitle": null,
      "hasChoices": false,
      "optionCount": 0,
      "options": [],
      "coinDelta": 0,
      "reputationDelta": 1350,
      "trigger": "Investment",
      "effect": "+1350 reputation from generous donations.",
      "target": "All",
      "targetSynergy": null,
      "cost": 900,
      "tier": 5,
      "coinPercentDelta": null,
      "duration": null,
      "effectType": null,
      "multiplier": null
    },
    {
      "id": "evt-christmas",
      "name": "Christmas",
      "storylineId": null,
      "storylineTitle": null,
      "hasChoices": false,
      "optionCount": 0,
      "options": [],
      "coinDelta": 600,
      "reputationDelta": 650,
      "trigger": "Investment",
      "effect": "+600 coins to all businesses and +650 reputation.",
      "target": "All",
      "targetSynergy": null,
      "cost": 1200,
      "tier": 3,
      "coinPercentDelta": null,
      "duration": null,
      "effectType": null,
      "multiplier": null
    },
    {
      "id": "evt-community-garden",
      "name": "Garden Party",
      "storylineId": null,
      "storylineTitle": null,
      "hasChoices": false,
      "optionCount": 0,
      "options": [],
      "coinDelta": 350,
      "reputationDelta": 450,
      "trigger": "Investment",
      "effect": "+350 coin and +450 reputation from a new community garden project.",
      "target": "All",
      "targetSynergy": null,
      "cost": 700,
      "tier": 2,
      "coinPercentDelta": null,
      "duration": null,
      "effectType": null,
      "multiplier": null
    },
    {
      "id": "evt-community-renovation",
      "name": "Community Renovation",
      "storylineId": null,
      "storylineTitle": null,
      "hasChoices": false,
      "optionCount": 0,
      "options": [],
      "coinDelta": 0,
      "reputationDelta": 0,
      "trigger": "Investment",
      "effect": "All reputation income boosted to 120% for 4 turns.",
      "target": "All",
      "targetSynergy": null,
      "cost": 1000,
      "tier": 12,
      "coinPercentDelta": null,
      "duration": 4,
      "effectType": "rep-multiplier",
      "multiplier": 1.2
    },
    {
      "id": "evt-construction",
      "name": "Road Construction",
      "storylineId": null,
      "storylineTitle": null,
      "hasChoices": false,
      "optionCount": 0,
      "options": [],
      "coinDelta": -100,
      "reputationDelta": 0,
      "trigger": "Incident",
      "effect": "-100 coin to all businesses from reduced foot traffic.",
      "target": "All",
      "targetSynergy": null,
      "cost": 0,
      "tier": 6,
      "coinPercentDelta": null,
      "duration": null,
      "effectType": null,
      "multiplier": null
    },
    {
      "id": "evt-cultural-grant",
      "name": "Cultural Grant",
      "storylineId": null,
      "storylineTitle": null,
      "hasChoices": false,
      "optionCount": 0,
      "options": [],
      "coinDelta": 100,
      "reputationDelta": 100,
      "trigger": "Incident",
      "effect": "+100 coin per Culture business and +100 reputation from a government arts grant.",
      "target": "SpecificSynergy",
      "targetSynergy": "Culture",
      "cost": 100,
      "tier": 8,
      "coinPercentDelta": null,
      "duration": null,
      "effectType": null,
      "multiplier": null
    },
    {
      "id": "evt-depression",
      "name": "Depression",
      "storylineId": "storyline-economy",
      "storylineTitle": "Economic Downturn",
      "hasChoices": false,
      "optionCount": 0,
      "options": [],
      "coinDelta": 0,
      "reputationDelta": 0,
      "trigger": "Incident",
      "effect": "All businesses generate 50% income for 5 turns.",
      "target": "All",
      "targetSynergy": null,
      "cost": 100,
      "tier": 9,
      "coinPercentDelta": null,
      "duration": 5,
      "effectType": "income-multiplier",
      "multiplier": 0.5
    },
    {
      "id": "evt-easter",
      "name": "Easter",
      "storylineId": null,
      "storylineTitle": null,
      "hasChoices": false,
      "optionCount": 0,
      "options": [],
      "coinDelta": 200,
      "reputationDelta": 500,
      "trigger": "Investment",
      "effect": "+200 coin to all businesses and +500 reputation.",
      "target": "All",
      "targetSynergy": null,
      "cost": 800,
      "tier": 4,
      "coinPercentDelta": null,
      "duration": null,
      "effectType": null,
      "multiplier": null
    },
    {
      "id": "evt-farm-table",
      "name": "Farm-to-Table Feature",
      "storylineId": "storyline-restaurant",
      "storylineTitle": "Restaurant Renaissance",
      "hasChoices": false,
      "optionCount": 0,
      "options": [],
      "coinDelta": 400,
      "reputationDelta": 65,
      "trigger": "Incident",
      "effect": "Farm-to-table features earn 400 coins and 65 reputation.",
      "target": "All",
      "targetSynergy": null,
      "cost": 0,
      "tier": 5,
      "coinPercentDelta": null,
      "duration": null,
      "effectType": null,
      "multiplier": null
    },
    {
      "id": "evt-farmers-market",
      "name": "Farmers Market Day",
      "storylineId": null,
      "storylineTitle": null,
      "hasChoices": false,
      "optionCount": 0,
      "options": [],
      "coinDelta": 100,
      "reputationDelta": 100,
      "trigger": "Incident",
      "effect": "+100 coin per Food business and +100 reputation.",
      "target": "SpecificSynergy",
      "targetSynergy": "Food",
      "cost": 0,
      "tier": 5,
      "coinPercentDelta": null,
      "duration": null,
      "effectType": null,
      "multiplier": null
    },
    {
      "id": "evt-festival",
      "name": "Local Festival",
      "storylineId": null,
      "storylineTitle": null,
      "hasChoices": false,
      "optionCount": 0,
      "options": [],
      "coinDelta": 200,
      "reputationDelta": 100,
      "trigger": "Investment",
      "effect": "+200 coins to all Culture businesses and +100 reputation.",
      "target": "SpecificSynergy",
      "targetSynergy": "Culture",
      "cost": 300,
      "tier": 1,
      "coinPercentDelta": null,
      "duration": null,
      "effectType": null,
      "multiplier": null
    },
    {
      "id": "evt-festival-season",
      "name": "Festival Season",
      "storylineId": null,
      "storylineTitle": null,
      "hasChoices": false,
      "optionCount": 0,
      "options": [],
      "coinDelta": 550,
      "reputationDelta": 0,
      "trigger": "Investment",
      "effect": "+550 coins from increased tourist spending during festival season.",
      "target": "All",
      "targetSynergy": null,
      "cost": 500,
      "tier": 12,
      "coinPercentDelta": null,
      "duration": null,
      "effectType": null,